{"$schema":"https://json-schema.org/draft/2020-12/schema","type":"object","required":["schema_version","target_id","adapter","expected_distribution","constraints","secrets","privacy"],"properties":{"schema_version":{"const":1},"target_id":{"type":"string"},"adapter":{"type":"object"},"expected_distribution":{"type":"object"},"constraints":{"type":"object"},"secrets":{"type":"object"},"privacy":{"type":"object"}},"additionalProperties":false}
